{
  "schema_version": "source-rights-evidence/1",
  "source": {
    "uri": "https://publisher.example/article-unknown",
    "identity": {
      "scheme": "canonical_uri",
      "value": "https://publisher.example/article-unknown"
    }
  },
  "intended_use": {
    "purpose": "ai-input",
    "user_class": "commercial"
  },
  "observation": {
    "declaration_state": "unknown",
    "observed_at": "2026-10-06T10:00:00Z",
    "expires_at": "2026-10-06T13:00:00Z",
    "evidence_ref": "urn:sha256:1333333333333333333333333333333333333333333333333333333333333333",
    "source_hashes": [
      "sha256:2333333333333333333333333333333333333333333333333333333333333333"
    ],
    "license_refs": []
  },
  "integrity": {
    "verification_status": "verified",
    "signature_algorithm": "Ed25519",
    "signer_key_id": "synthetic-provider-key-2026-01",
    "key_fingerprint": "sha256:3333333333333333333333333333333333333333333333333333333333333333",
    "verified_at": "2026-10-06T10:00:02Z",
    "raw_artifact_sha256": "sha256:4333333333333333333333333333333333333333333333333333333333333333"
  },
  "interpretation": {
    "legal_clearance": false,
    "requires_human_review": true
  }
}
