{
  "schema_version": "source-rights-evidence/1",
  "source": {
    "uri": "https://publisher.example/article-current",
    "identity": {
      "scheme": "canonical_uri",
      "value": "https://publisher.example/article-current"
    }
  },
  "intended_use": {
    "purpose": "ai-train",
    "user_class": "commercial"
  },
  "observation": {
    "declaration_state": "declared_permitted_for_purpose",
    "observed_at": "2026-10-06T10:30:00Z",
    "expires_at": "2026-10-06T13:30:00Z",
    "evidence_ref": "urn:sha256:1111111111111111111111111111111111111111111111111111111111111111",
    "source_hashes": [
      "sha256:2111111111111111111111111111111111111111111111111111111111111111"
    ],
    "license_refs": []
  },
  "integrity": {
    "verification_status": "verified",
    "signature_algorithm": "Ed25519",
    "signer_key_id": "synthetic-provider-key-2026-01",
    "key_fingerprint": "sha256:3111111111111111111111111111111111111111111111111111111111111111",
    "verified_at": "2026-10-06T10:30:02Z",
    "raw_artifact_sha256": "sha256:4111111111111111111111111111111111111111111111111111111111111111"
  },
  "interpretation": {
    "legal_clearance": false,
    "requires_human_review": true
  }
}
